{
  "artifact_ownership": [
    {
      "artifact": "Researcher(id)",
      "consumers": ["Planner", "TripleValidation"],
      "owner": "Researcher"
    },
    {
      "artifact": "plan_id",
      "consumers": [
        "Planner",
        "Refactor",
        "GapAnalysis",
        "GapCheck",
        "GapFix",
        "GapRecheck",
        "Evaluation",
        "SchemaValidation",
        "FixtureValidation",
        "GoalValidation"
      ],
      "owner": "Researcher"
    },
    {
      "artifact": "schema_id",
      "consumers": ["SchemaValidation"],
      "owner": "Researcher"
    },
    {
      "artifact": "fixture_id",
      "consumers": ["FixtureValidation"],
      "owner": "Researcher"
    },
    {
      "artifact": "goal_id",
      "consumers": ["GoalValidation"],
      "owner": "Researcher"
    },
    {
      "artifact": "validation_id",
      "consumers": ["TripleValidation"],
      "owner": "Researcher"
    },
    {
      "artifact": "audit_id",
      "consumers": ["Refactor"],
      "owner": "Planner"
    },
    {
      "artifact": "gap_0",
      "consumers": ["Evaluation"],
      "owner": "GapAnalysis"
    },
    {
      "artifact": "evaluation",
      "consumers": ["SchemaValidation", "FixtureValidation", "GoalValidation"],
      "owner": "Evaluation"
    },
    {
      "artifact": "schema_validation_result",
      "consumers": ["TripleValidation"],
      "owner": "SchemaValidation"
    },
    {
      "artifact": "fixture_validation_result",
      "consumers": ["TripleValidation"],
      "owner": "FixtureValidation"
    },
    {
      "artifact": "goal_validation_result",
      "consumers": ["TripleValidation"],
      "owner": "GoalValidation"
    },
    {
      "artifact": "confirmed_package",
      "consumers": ["Hash", "Builder"],
      "owner": "Confirmed"
    },
    {
      "artifact": "HASH",
      "consumers": ["Builder", "Finalize"],
      "owner": "Hash"
    },
    {
      "artifact": "build_result",
      "consumers": ["Finalize"],
      "owner": "Builder"
    },
    {
      "artifact": "execution_evidence",
      "consumers": ["Finalize"],
      "owner": "Builder"
    },
    {
      "artifact": "hash_sandbox",
      "consumers": ["Finalize"],
      "owner": "Builder"
    },
    {
      "artifact": "hash_proof",
      "consumers": ["Finalize"],
      "owner": "Hash"
    }
  ],
  "edges": [
    {"artifact": "Prompt_id", "from": "Prompt", "to": "Researcher"},
    {"artifact": "plan_id", "from": "Researcher", "to": "Planner"},
    {"artifact": "audit_id", "from": "Planner", "to": "Refactor"},
    {"artifact": "plan_id", "from": "Refactor", "to": "GapAnalysis"},
    {"artifact": "plan_id", "from": "GapAnalysis", "to": "GapCheck"},
    {"artifact": "gaps_found", "from": "GapCheck", "to": "GapFix"},
    {"artifact": "gap_0+plan_id", "from": "GapCheck", "to": "GapAnalysisComplete"},
    {"artifact": "plan_id", "from": "GapFix", "to": "GapRecheck"},
    {"artifact": "gaps_remaining", "from": "GapRecheck", "to": "GapCheck"},
    {"artifact": "gap_0+plan_id", "from": "GapRecheck", "to": "GapAnalysisComplete"},
    {"artifact": "gap_0+plan_id", "from": "GapAnalysisComplete", "to": "Evaluation"},
    {"artifact": "plan_id", "from": "Evaluation", "to": "SchemaValidation"},
    {"artifact": "plan_id", "from": "Evaluation", "to": "FixtureValidation"},
    {"artifact": "plan_id", "from": "Evaluation", "to": "GoalValidation"},
    {"artifact": "schema_id", "from": "Researcher", "to": "SchemaValidation"},
    {"artifact": "fixture_id", "from": "Researcher", "to": "FixtureValidation"},
    {"artifact": "goal_id", "from": "Researcher", "to": "GoalValidation"},
    {"artifact": "validation_id", "from": "Researcher", "to": "TripleValidation"},
    {"artifact": "schema_validation_result", "from": "SchemaValidation", "to": "TripleValidation"},
    {"artifact": "fixture_validation_result", "from": "FixtureValidation", "to": "TripleValidation"},
    {"artifact": "goal_validation_result", "from": "GoalValidation", "to": "TripleValidation"},
    {"artifact": "triple_validation", "from": "TripleValidation", "to": "Confirmed"},
    {"artifact": "confirmed_package", "from": "Confirmed", "to": "Hash"},
    {"artifact": "confirmed_package", "from": "Confirmed", "to": "Builder"},
    {"artifact": "HASH", "from": "Hash", "to": "Builder"},
    {"artifact": "hash_sandbox", "from": "Builder", "to": "Finalize"},
    {"artifact": "build_result", "from": "Builder", "to": "Finalize"},
    {"artifact": "hash_proof", "from": "Hash", "to": "Finalize"},
    {"artifact": "verified_HASH", "from": "Finalize", "to": "Done"},
    {"artifact": "research_bundle", "from": "Researcher.completedResult", "to": "ResearchReview.input"}
  ],
  "nodes": [
    {"id": "Prompt", "kind": "source"},
    {"id": "Researcher", "kind": "processor"},
    {"id": "Researcher.completedResult", "kind": "gate"},
    {"id": "ResearchReview.input", "kind": "gate"},
    {"id": "Planner", "kind": "processor"},
    {"id": "Refactor", "kind": "processor"},
    {"id": "GapAnalysis", "kind": "processor"},
    {"id": "GapCheck", "kind": "processor"},
    {"id": "GapFix", "kind": "processor"},
    {"id": "GapRecheck", "kind": "processor"},
    {"id": "GapAnalysisComplete", "kind": "processor"},
    {"id": "Evaluation", "kind": "processor"},
    {"id": "SchemaValidation", "kind": "validator"},
    {"id": "FixtureValidation", "kind": "validator"},
    {"id": "GoalValidation", "kind": "validator"},
    {"id": "TripleValidation", "kind": "gate"},
    {"id": "Confirmed", "kind": "gate"},
    {"id": "Hash", "kind": "proof"},
    {"id": "Builder", "kind": "processor"},
    {"id": "Finalize", "kind": "proof"},
    {"id": "Done", "kind": "terminal"}
  ],
  "parallel_groups": [
    {
      "group_id": "TripleValidation",
      "join": "TripleValidation",
      "members": ["SchemaValidation", "FixtureValidation", "GoalValidation"]
    }
  ],
  "workflow_agents": [
    {
      "id": "OneShotCanonicalWorkflow",
      "type": "SequentialAgent",
      "members": [
        "Researcher",
        "Planner",
        "Refactor",
        "GapAnalysis",
        "Evaluation",
        "TripleValidation",
        "Confirmed",
        "Hash",
        "Builder",
        "Finalize",
        "Done"
      ]
    },
    {
      "id": "GapAnalysisLoop",
      "type": "LoopAgent",
      "members": ["GapCheck", "GapFix", "GapRecheck"],
      "exit": "GapAnalysisComplete"
    },
    {
      "id": "TripleValidationParallel",
      "type": "ParallelAgent",
      "members": ["SchemaValidation", "FixtureValidation", "GoalValidation"],
      "join": "TripleValidation"
    }
  ],
  "version": "2",
  "workflow_id": "oneshot-canonical-workflow"
}
